id,parent_id,level,objectid,objecttype,querystatus,querytime,querytype,message,created_time
737,51,2,10154721163825685_10154721193730685,data,fetched (200),52:16.8,Facebook:<post>/comments,Harmony,2017-08-31T16:19:11+0000
738,51,2,10154721163825685_10154721189215685,data,fetched (200),52:16.8,Facebook:<post>/comments,Izzie Redman,2017-08-31T16:16:06+0000
740,51,2,10154721163825685_10154723206495685,data,fetched (200),52:16.8,Facebook:<post>/comments,Shane Stanford Preston Kamradt isn't this that rapper you like,2017-09-01T13:42:03+0000
741,51,2,10154721163825685_10154722474935685,data,fetched (200),52:16.8,Facebook:<post>/comments,Felix,2017-09-01T04:51:19+0000
742,51,2,10154721163825685_10154721175955685,data,fetched (200),52:16.8,Facebook:<post>/comments,Bebe Rodriguez,2017-08-31T16:06:48+0000
743,51,2,10154721163825685_10154725536315685,data,fetched (200),52:16.8,Facebook:<post>/comments,Sean Sylvain,2017-09-02T12:49:08+0000
627,52,2,10154713885480685_10154713896425685,data,fetched (200),52:05.6,Facebook:<post>/comments,John Draper's passion and expertise  saves lives every day! Thank you John!,2017-08-28T19:14:34+0000
628,52,2,10154713885480685_10154714711770685,data,fetched (200),52:05.6,Facebook:<post>/comments,"As a mental health social worker, I certainly appreciate this as a resource!",2017-08-29T02:43:04+0000
629,52,2,10154713885480685_10154713961755685,data,fetched (200),52:05.6,Facebook:<post>/comments,My cousin shot himself in the heart 7-25-17 he was 22  My best friend and  cousin raised with me  Im grieving still ive never lost someone so close,2017-08-28T19:45:48+0000
630,52,2,10154713885480685_10154714878400685,data,fetched (200),52:05.6,Facebook:<post>/comments,I lost my partner of 28 years and I just cannot get over it.  I have been contemplating suicide lately.  I have never in my life lived alone and I have nobody.,2017-08-29T04:50:15+0000
631,52,2,10154713885480685_10154714533065685,data,fetched (200),52:05.6,Facebook:<post>/comments,Thank you so much for helping me last month. Y'all are appreciated. I wouldn't be here if it wasn't for you guys. 💕,2017-08-29T00:48:01+0000
632,52,2,10154713885480685_10154714346195685,data,fetched (200),52:05.6,Facebook:<post>/comments,I've texted that and I felt like I was talking to a computer. No feeling.,2017-08-28T22:56:16+0000
633,52,2,10154713885480685_10154714039480685,data,fetched (200),52:05.6,Facebook:<post>/comments,Losing children in family court kills a parent inside. Courts use this to even further keep your children from you. It's a tactic that is horrible to use against someone,2017-08-28T20:34:48+0000
634,52,2,10154713885480685_10154713900610685,data,fetched (200),52:05.6,Facebook:<post>/comments,I love it ... something needs to be done to help people suffering with depression ... prevent suicide ... R.I.P to my big brother a victim of suicide ..Oscar Skorepa,2017-08-28T19:16:17+0000
635,52,2,10154713885480685_10154714447835685,data,fetched (200),52:05.6,Facebook:<post>/comments,Get on Twitter please! IT'S the platform next to instagram teens are using!,2017-08-28T23:51:50+0000
636,52,2,10154713885480685_10154714036760685,data,fetched (200),52:05.6,Facebook:<post>/comments,My son died by suicide a month ago but I never knew what to say....💔,2017-08-28T20:33:32+0000
637,52,2,10154713885480685_10154713895060685,data,fetched (200),52:05.6,Facebook:<post>/comments,I lost and found my son gone forever to suicide. I fully support you on Tyler's memorial page constantly 💚🌹🙏🏼😓😔,2017-08-28T19:13:57+0000
638,52,2,10154713885480685_10154714760845685,data,fetched (200),52:05.6,Facebook:<post>/comments,I am thankful y'all are helping folks. Sadly disappointed you reject posts from local efforts not associated with your organization. Seems all efforts combined are essential.,2017-08-29T03:09:16+0000
639,52,2,10154713885480685_10154713914205685,data,fetched (200),52:05.6,Facebook:<post>/comments,Such an important conversation. We really must do more to encourage folks to break the silence.,2017-08-28T19:21:38+0000
640,52,2,10154713885480685_10154713900790685,data,fetched (200),52:05.6,Facebook:<post>/comments,I'm a suicide attempt survivor. It scared me when I heard the fear and hurt in my moms voice when she found out.,2017-08-28T19:16:21+0000
641,52,2,10154713885480685_10154726206880685,data,fetched (200),52:05.6,Facebook:<post>/comments,Wish I had known how to help my beautiful Granddaughter.  Now it's too late. Awareness is so important.,2017-09-02T18:30:13+0000
642,52,2,10154713885480685_10154714676055685,data,fetched (200),52:05.6,Facebook:<post>/comments,It's too late for my sweet boy but there are so many young people that need our HELP-THANK YOU!!!,2017-08-29T02:26:21+0000
643,52,2,10154713885480685_10154715145810685,data,fetched (200),52:05.6,Facebook:<post>/comments,God bless life line. They make u feel that u matter in this world. Thankyou xx.,2017-08-29T08:13:13+0000
644,52,2,10154713885480685_10154714425255685,data,fetched (200),52:05.6,Facebook:<post>/comments,I have done suicide so I'm a suicide survivor I want to help and all suicide survivors can say they want to help I have met a few of them,2017-08-28T23:37:35+0000
645,52,2,10154713885480685_10154785264605685,data,fetched (200),52:05.6,Facebook:<post>/comments,Does thoughts of suicide always relate to depression?,2017-09-27T02:31:09+0000
646,52,2,10154713885480685_10154714366735685,data,fetched (200),52:05.6,Facebook:<post>/comments,"I don't need a suicide counselor, I need a living wage. I only feel like killing myself when I am faced with homelessness and /or poverty. Life is so hard and unfair I don't feel like doing it anymore.",2017-08-28T23:06:12+0000
647,52,2,10154713885480685_10154714497165685,data,fetched (200),52:05.6,Facebook:<post>/comments,How do we save the ones that don't talk about it? I think there are 2 different types of suicidal victims. The ones that want help and the ones that truly fight every day to stay alive. There is a difference.,2017-08-29T00:19:00+0000
648,52,2,10154713885480685_10154714669695685,data,fetched (200),52:05.6,Facebook:<post>/comments,Everyone one of you watching this MATTERS! You are WANTED! you are LOVED! I lost one of my best friends to suicide! It will be five years October 17th 😭 and the pain of missing her never goes away! Someone CARES about YOU!,2017-08-29T02:21:46+0000
649,52,2,10154713885480685_10154715182270685,data,fetched (200),52:05.6,Facebook:<post>/comments,"I do appreciate what your saying or trying to do but sometimes it happens randomly, but tbf since the meds that apparently don't work down to the stigma of where i live it's been about 9 months so for me that's doing well lol",2017-08-29T08:51:11+0000
650,52,2,10154713885480685_10154714272500685,data,fetched (200),52:05.6,Facebook:<post>/comments,I lost my son Brett Lake Morris on June 16th to suicide. We miss him and love him. This has to be the hardest thing ever imagineable to a parent.  I just wish he would have talked to someone.  People do care and are listening.,2017-08-28T22:15:15+0000
651,52,2,10154713885480685_10154714035900685,data,fetched (200),52:05.6,Facebook:<post>/comments,I am wondering when NSPL will address what family court is doing to parents and how it leaves some of us feeling that suicide is the only option? Child support is forcing parents into feeling like they have no option other than death.,2017-08-28T20:33:05+0000
653,52,2,10154713885480685_10154716187005685,data,fetched (200),52:06.1,Facebook:<post>/comments,"My Son, Isaac took his life 18 months ago. I take business cards to schools and other place with the phone number  and my Sons photo on them. I get hugs from so many young people. Thank you for all you do by being there on the phone!! 💖",2017-08-29T18:13:17+0000
654,52,2,10154713885480685_10154713909705685,data,fetched (200),52:06.1,Facebook:<post>/comments,When you are alone. When you have the cold metal to your wrist and you just feel nothing. Last night I was able to stop myself but the only thing I can think of is returning home to that straight razor and the damage it has already done to my arm.,2017-08-28T19:19:42+0000
655,52,2,10154713885480685_10154714431790685,data,fetched (200),52:06.1,Facebook:<post>/comments,"Thank you for having these conversations! It's not easy, especially when you're struggling and feeling isolated. Thank you to my fellow survivors for fighting, thank you to those who reach out to those at risk for suicide. We need to care for one another.",2017-08-28T23:41:09+0000
656,52,2,10154713885480685_10154714340470685,data,fetched (200),52:06.1,Facebook:<post>/comments,"I live in a 2.2 square mile town that was hit very hard with the tragedy of suicide. There were 3 precious lives lost in 7 short weeks. The youngest of the 3, an 11 year old boy! Please help me get a program into not just our schools but our community as a whole.",2017-08-28T22:51:16+0000
657,52,2,10154713885480685_10154713897470685,data,fetched (200),52:06.1,Facebook:<post>/comments,I tell everyone daily to call you guys.,2017-08-28T19:14:55+0000
658,52,2,10154713885480685_10154714778095685,data,fetched (200),52:06.1,Facebook:<post>/comments,Want to some hand outs for the school,2017-08-29T03:23:18+0000
659,52,2,10154713885480685_10154714004330685,data,fetched (200),52:06.1,Facebook:<post>/comments,Is it true you can text now?,2017-08-28T20:10:49+0000
660,52,2,10154713885480685_10154713903325685,data,fetched (200),52:06.1,Facebook:<post>/comments,I have to stop being so afraid to call,2017-08-28T19:17:28+0000
661,52,2,10154713885480685_10154714783010685,data,fetched (200),52:06.1,Facebook:<post>/comments,Thank you for the work you do.,2017-08-29T03:27:05+0000
662,52,2,10154713885480685_10154713893555685,data,fetched (200),52:06.1,Facebook:<post>/comments,How can I contact them about a program,2017-08-28T19:13:22+0000
663,52,2,10154713885480685_10154714413315685,data,fetched (200),52:06.1,Facebook:<post>/comments,I'm so sorry Caroline ❤️❤️,2017-08-28T23:30:05+0000
664,52,2,10154713885480685_10154713902640685,data,fetched (200),52:06.1,Facebook:<post>/comments,Thank you for this,2017-08-28T19:17:08+0000
665,52,2,10154713885480685_10154713955795685,data,fetched (200),52:06.1,Facebook:<post>/comments,I lost my husband 14years ago on aug 30,2017-08-28T19:41:26+0000
666,52,2,10154713885480685_10154713956985685,data,fetched (200),52:06.1,Facebook:<post>/comments,I wanna help,2017-08-28T19:42:43+0000
667,52,2,10154713885480685_10154713906125685,data,fetched (200),52:06.1,Facebook:<post>/comments,I lost my son to suicide,2017-08-28T19:18:30+0000
668,52,2,10154713885480685_10154714461510685,data,fetched (200),52:06.1,Facebook:<post>/comments,I can even private message me,2017-08-29T00:01:07+0000
669,52,2,10154713885480685_10154714415265685,data,fetched (200),52:06.1,Facebook:<post>/comments,I lost my son Christopher ❤️❤️,2017-08-28T23:31:01+0000
670,52,2,10154713885480685_10154714352950685,data,fetched (200),52:06.1,Facebook:<post>/comments,Hard time opening up.,2017-08-28T23:00:31+0000
671,52,2,10154713885480685_10154716593550685,data,fetched (200),52:06.1,Facebook:<post>/comments,I tried to kill myself twice thank God someone came to help me,2017-08-29T21:33:45+0000
672,52,2,10154713885480685_10154716583660685,data,fetched (200),52:06.1,Facebook:<post>/comments,My beloved Ezra committed suicide *,2017-08-29T21:27:56+0000
673,52,2,10154713885480685_10154719081730685,data,fetched (200),52:06.1,Facebook:<post>/comments,"I just got off the phone with Rose. Why is it so hard to find your number?

Mom, at 95 sharp as a tack to the end, died Saturday the 25th, 7 children but I am the only one in trauma from her death due to all the conversations left one-ended.

I'm going to take a nap and hope it's a happier world when I wake up.",2017-08-30T19:32:23+0000
674,52,2,10154713885480685_10154713903230685,data,fetched (200),52:06.1,Facebook:<post>/comments,I'm glad you're still here Arthur. I lost and found my son gone forever to suicide 😓💔💯,2017-08-28T19:17:25+0000
675,52,2,10154713885480685_10154714493825685,data,fetched (200),52:06.1,Facebook:<post>/comments,"I think it's more hard to talk about it, when people don't realise that it is a chemical imbalance on some occasions , sometimes, the thoughts just pop in your head. I once got ""what have you got to be depressed about, you've got a job, a roof over your head and you're so happy all the time"". You don't always need a reason. You guys have helped me a number of times, for that, I'm grateful. Keep up the good work, and thank you! ✌🏻",2017-08-29T00:16:15+0000
676,52,2,10154713885480685_10154720268870685,data,fetched (200),52:06.1,Facebook:<post>/comments,Im graduated from high school and my senior year was the absolute worst i was judged about the most little things because i wasn't good in a subject and that was math and i lost all my friends because drama and i would come home and just stay in my room my family doesn't care nobody cares until something dramatic happens and that's the truth of it and im sick of all these people saying you matter YOU MATTER if they matter why doesn't anyone realise the signs that someone is depressed nobody really cares until its done and they are gone,2017-08-31T07:11:05+0000
677,52,2,10154713885480685_10154716183030685,data,fetched (200),52:06.1,Facebook:<post>/comments,"I had a plan when I was 16, my parents discovered my plan and accused me only wanting attention.  I perfected my plan into a fool proof, highly successful suicide, after 5 years of marriage, because I felt so trapped.  Thoughts of who would be raising my children, would be the only reason why I did not follow through.  My divorce, would be the start of me ending my suicide plan.  The only thing that would bring the plan back to life, is if anything were to happen to my children.  My two sons, and my daughter in-law are the only family I have.",2017-08-29T18:11:06+0000
679,52,2,10154713885480685_10154755137035685,data,fetched (200),52:06.6,Facebook:<post>/comments,"Hello, I found this useful and thought you would be interested in the following article: 

Mental health feleling sick 
Pins and needles in hands and feet 
Feeling dizzy and lightheaded 
Finding it hard to sleep 
Going to the toilet often 
Feeling nervous and fearful 
Feeling like the room is spinning when indoors and when 
Outdoors feel like everything is moving fast
My head feels over crowded with too many thoughts, 
Sometimes I have negative feelings that I can't control 
Thinking about pass negative experiences or situations from canan Dogan symptoms of anxiousness",2017-09-14T17:45:21+0000
680,52,2,10154713885480685_10154713916580685,data,fetched (200),52:06.6,Facebook:<post>/comments,"I hope to See All My Facebook Friends will Change Their Facebook Profile Picture to Black and White to Show Support for Suicide Prevention as Suicide Awareness is September 10th I'm personally a Suicide Warrior and Now a Advocate and Mental Health Coach and Educator I Changed My Picture Will YOU 💚
Let People Who Are Feeling Suicidal See You Are Their to Support Them by Going Black and White on Your Facebook Or All Your Social Media Profile then copy and paste this to your Facebook 

#YourMentalillnessMatters #BecauseYouMatter #suicideprevention #suicideawareness #Isupportmentalwellness #bethechange #StoptheStigma",2017-08-28T19:22:38+0000
681,52,2,10154713885480685_10154714418940685,data,fetched (200),52:06.6,Facebook:<post>/comments,"I called and spoke with a man the other day and he was very patient and helpful. I tried calling today but was sent to a local center here in my town and I knew the person on the other line so I hung up.... I don't want to kill myself but I don't wanna live. 5 years, 3 months. & and 20 days ago my 15 year old took her life due to bullying. 2 months before her 16th bday. I found her and I struggle daily still. I've went to individual and group counseling and meds buts nothing seems to help. I want to just die in my sleep. I hang on because of my other 2 kids but it's so damn hard..... I lost most of my friends and family. I don't know what to do anymore. Suicidal thoughts are getting strong each day. Again I don't think I could follow through with it but I pray to God daily to take me out of this nightmare.... GOD PLEASE HELP ME",2017-08-28T23:33:10+0000
682,52,2,10154713885480685_10154713958225685,data,fetched (200),52:06.6,Facebook:<post>/comments,"Please share this on your page and help me....

Hey my name is Courtney Bailey from Pineywoods Al , I lost a cousin that was raised as my brother on July 25th 2017 to suicide at the young age of 22.  He suffered severe depression. I'm trying to raise awareness. There's not 1 person that deserves to feel worthless, I would like to promote suicide awareness I want everyone suffering to know it's not the end they are not alone. Sawyer Bailey took on many burdens including some of my own and I feel I owe him this much. Make him your hero because he is mine.

Dont be afraid to ask for help! 
You are not alone
If you feel there's nobody there's me nomatter who you are!
Don't let another light go out! 
Keep your faith 
Your story isn't over 
#suicideprevention 
#LongLiveBuck
;;;;;;;;;;;;;;;;;;;;

Share share share please
Help Buck save lives through his story...i want to help others!!",2017-08-28T19:43:12+0000
683,52,2,10154713885480685_10154758869980685,data,fetched (200),52:06.6,Facebook:<post>/comments,"Ibeen thinking of ending it all.. feel so empty and alone...i know that no one would care, no one...i dont know why im waiting... rwcently had a stoke none realy cared... nust tieed of the hazzke...",2017-09-15T23:18:45+0000
684,52,2,10154713885480685_10154714352535685,data,fetched (200),52:06.6,Facebook:<post>/comments,I go to a therapist and I've talked to this group I'm still feeling real empty,2017-08-28T23:00:03+0000
685,52,2,10154713885480685_10154713912240685,data,fetched (200),52:06.6,Facebook:<post>/comments,Tiffanni Skyler Rose YOU MATTER!!!!!! Call them please,2017-08-28T19:20:55+0000
686,52,2,10154713885480685_10154713913520685,data,fetched (200),52:06.6,Facebook:<post>/comments,Tiffany I'm sorry for your pain !!,2017-08-28T19:21:24+0000
687,52,2,10154713885480685_10154714418845685,data,fetched (200),52:06.6,Facebook:<post>/comments,Tifanni you should CALL!!,2017-08-28T23:33:07+0000
688,52,2,10154713885480685_10154714460300685,data,fetched (200),52:06.6,Facebook:<post>/comments,Yes Tiffanni please please call them. It really does help,2017-08-29T00:00:13+0000
689,52,2,10154713885480685_10154714229235685,data,fetched (200),52:06.6,Facebook:<post>/comments,Learn how you can be the one to save a life.,2017-08-28T21:54:59+0000
690,52,2,10154713885480685_10154714775080685,data,fetched (200),52:06.6,Facebook:<post>/comments,I want information. To hand out at the school,2017-08-29T03:20:32+0000
691,52,2,10154713885480685_10154713905995685,data,fetched (200),52:06.6,Facebook:<post>/comments,They also help us grieving moms,2017-08-28T19:18:27+0000
692,52,2,10154713885480685_10154713895960685,data,fetched (200),52:06.6,Facebook:<post>/comments,It's an increasing epidemic,2017-08-28T19:14:21+0000
693,52,2,10154713885480685_10154713914155685,data,fetched (200),52:06.6,Facebook:<post>/comments,Absolutely agreed,2017-08-28T19:21:37+0000
694,52,2,10154713885480685_10154713909990685,data,fetched (200),52:06.6,Facebook:<post>/comments,"Hey, John Draper!",2017-08-28T19:19:51+0000
695,52,2,10154713885480685_10154713923770685,data,fetched (200),52:06.6,Facebook:<post>/comments,Thank you,2017-08-28T19:25:11+0000
696,52,2,10154713885480685_10154713952325685,data,fetched (200),52:06.6,Facebook:<post>/comments,You Matter,2017-08-28T19:38:49+0000
697,52,2,10154713885480685_10154714676870685,data,fetched (200),52:06.6,Facebook:<post>/comments,Thank you JOHN DRAPER!!,2017-08-29T02:27:16+0000
698,52,2,10154713885480685_10154715183835685,data,fetched (200),52:06.6,Facebook:<post>/comments,@julie that's a very valid point,2017-08-29T08:53:14+0000
699,52,2,10154713885480685_10154713938570685,data,fetched (200),52:06.6,Facebook:<post>/comments,Excatley,2017-08-28T19:31:41+0000
700,52,2,10154713885480685_10154713924235685,data,fetched (200),52:06.6,Facebook:<post>/comments,Thank you!,2017-08-28T19:25:24+0000
701,52,2,10154713885480685_10154714461910685,data,fetched (200),52:06.6,Facebook:<post>/comments,You,2017-08-29T00:01:21+0000
702,52,2,10154713885480685_10154751040750685,data,fetched (200),52:06.6,Facebook:<post>/comments,❤️❤️,2017-09-13T05:19:10+0000
703,52,2,10154713885480685_10154713918615685,data,fetched (200),52:06.6,Facebook:<post>/comments,"Yes, John Draper !",2017-08-28T19:23:28+0000
705,52,2,10154713885480685_10154714416570685,data,fetched (200),52:06.6,Facebook:<post>/comments,Tiffani do you have any close family?,2017-08-28T23:31:59+0000
706,52,2,10154713885480685_10154713973730685,data,fetched (200),52:06.6,Facebook:<post>/comments,Stacy Michele,2017-08-28T19:49:09+0000
707,52,2,10154713885480685_10154716595440685,data,fetched (200),52:06.6,Facebook:<post>/comments,Thank You*,2017-08-29T21:34:55+0000
708,52,2,10154713885480685_10154716580995685,data,fetched (200),52:06.6,Facebook:<post>/comments,Reach OUT!,2017-08-29T21:26:07+0000
709,52,2,10154713885480685_10154716573850685,data,fetched (200),52:06.6,Facebook:<post>/comments,Every day!,2017-08-29T21:23:11+0000
710,52,2,10154713885480685_10154754475885685,data,fetched (200),52:06.6,Facebook:<post>/comments,Jimi Cunning I FEEL YA,2017-09-14T11:04:16+0000
745,54,2,10154713777320685_10154715168550685,data,fetched (200),52:26.3,Facebook:<post>/comments,"you have the right to feel, you have the right to be happy when your sad thats normal you have the right to eXperience all you love while your past still hurts you have the right to live",2017-08-29T08:35:48+0000
746,54,2,10154713777320685_10154714695040685,data,fetched (200),52:26.3,Facebook:<post>/comments,I've been feeling these feelings of suicide since the age of 12 arguments at home with my spouse brings back all suicidal thoughts because he's told me how I'm not his family and I never would be unless I prove to him he makes me feel useless and I tell him and he says he shuts down because he doesn't want to hear anything.I need help,2017-08-29T02:39:15+0000
747,54,2,10154713777320685_10154713802140685,data,fetched (200),52:26.3,Facebook:<post>/comments,Is there a doctor in the house♡♡♡,2017-08-28T18:27:26+0000
755,55,2,10154712522530685_10154714542670685,data,fetched (200),52:38.6,Facebook:<post>/comments,"Departure date
Feb 9th 2017
And noone can talk me out of it
I am preparing for it & welcome it!
My CPTSD has destroyed my life. I am a hollow shell.",2017-08-29T00:53:13+0000
756,55,2,10154712522530685_10154712896945685,data,fetched (200),52:38.6,Facebook:<post>/comments,"Is there anyone that will PLEASE just talk to me
..... 😭😭😭",2017-08-28T09:16:30+0000
757,55,2,10154712522530685_10154716399995685,data,fetched (200),52:38.6,Facebook:<post>/comments,Is there anyway I can just talk to someone through FB messaging or texting bc when I start to talk about it I cry and then it's just wasting your time on the phone!,2017-08-29T19:50:03+0000
758,55,2,10154712522530685_10154714456515685,data,fetched (200),52:38.6,Facebook:<post>/comments,I just got out of PPI. The way me life is going I wish I would've killed my self! I'm behind on all of my bills and stressed out.,2017-08-28T23:57:31+0000
759,55,2,10154712522530685_10154712563180685,data,fetched (200),52:38.6,Facebook:<post>/comments,"I wish your website worked more for me, I get to 3rd in queue then it jumps further and further back like it is a sign or something.",2017-08-28T04:08:50+0000
760,55,2,10154712522530685_10154712579015685,data,fetched (200),52:38.6,Facebook:<post>/comments,I don't need a pep talk I need practical solutions to legitimate problems. I have problem A and resources B how can i accomplish C?? Not you're in our prayers; if prayer worked I wouldn't have problems atm,2017-08-28T04:24:20+0000
761,55,2,10154712522530685_10154716710160685,data,fetched (200),52:38.6,Facebook:<post>/comments,I have tried calling the hotline and my phone keeps hanging up. The last thing I hear is D241. I just need to talk to someone; I hate living just to survive.,2017-08-29T22:20:01+0000
762,55,2,10154712522530685_10154712921745685,data,fetched (200),52:38.6,Facebook:<post>/comments,The thing is I do though nobody could possibly ever understand anymore and I'm tired of fighting I'm so fucking tired,2017-08-28T09:43:50+0000
763,55,2,10154712522530685_10154740173685685,data,fetched (200),52:38.6,Facebook:<post>/comments,"In the city where I live there is a crisis line by the community mental health, but the staff is is terrible. I needed them about 6 years ago but they told me they couldn't help me. I don't want anybody else to have to be confused by these people when they're already in a crisis. I'm going to post this number on my FB page.",2017-09-08T09:29:22+0000
764,55,2,10154712522530685_10154727413370685,data,fetched (200),52:38.6,Facebook:<post>/comments,Hey Can You Help? My Mom Keep Calling Me Psycho And I Deal With Depression. It Makes Me Wanna Die. I Don't Wanna Call And Y'all Never Open At My Available Time For Chatting On Here. Can Y'all Text Me On iMessage? My Phone Not On To Text Regular.,2017-09-03T06:03:06+0000
765,55,2,10154712522530685_10154713729950685,data,fetched (200),52:38.6,Facebook:<post>/comments,*Sigh*,2017-08-28T17:45:08+0000
766,55,2,10154712522530685_10154712525115685,data,fetched (200),52:38.6,Facebook:<post>/comments,Thank you for your ongoing commitment to prevent suicide!,2017-08-28T03:30:16+0000
