id,parent_id,level,objectid,objecttype,querystatus,querytime,querytype,message,created_time
37,1,1,11261740684_10154750166915685,data,fetched (200),53:18.8,Facebook:<page>/posts,It's #NSPW! Looking for ways to participate? Join our #BeThe1To movement and help save a life. Learn more at http://bit.ly/2wbnQRW,2017-09-12T19:34:00+0000
38,1,1,11261740684_10154747831120685,data,fetched (200),53:18.8,Facebook:<page>/posts,"""He didn't try to make anything better, he didn't try to fix it - he just listened to me, let me talk, and let me know that it was okay.""

#BeThe1To be there for someone else. It might mean more to them than you know.

#BeThere #NSPW",2017-09-11T18:14:20+0000
39,1,1,11261740684_10154747621290685,data,fetched (200),53:18.8,Facebook:<page>/posts,"If you're experiencing difficult emotions related to the 16 year anniversary of 9/11, reach out to the national Disaster Distress Helpline for emotional support. They are available 24/7/365 at 1-800-985-5990. #NeverForget",2017-09-11T15:58:12+0000
40,1,1,11261740684_10154746483135685,data,fetched (200),53:18.8,Facebook:<page>/posts,"""For the survivors, we're thankful. For the ones struggling, we support you. For those who aren't with us, we honor you."" #WorldSuicidePreventionDay #BeThe1To",2017-09-11T02:07:20+0000
41,1,1,11261740684_10154745168400685,data,fetched (200),53:18.8,Facebook:<page>/posts,Today is World Suicide Prevention Day. #BeThe1To to make a difference - stepping forward and reaching out can help save lives. 💚,2017-09-10T14:31:42+0000
42,1,1,11261740684_10154740629700685,data,fetched (200),53:18.8,Facebook:<page>/posts,Did you know you can create your own 5-step graphic kit for our #BeThe1To movement? Learn more: http://bit.ly/2uJrpP5,2017-09-08T14:24:17+0000
43,1,1,11261740684_10154738913255685,data,fetched (200),53:18.8,Facebook:<page>/posts,"Hope is happening every day. #BeThe1To

If you're feeling hopeless, call 1-800-273-TALK (8255) for help and support.",2017-09-07T19:39:02+0000
44,1,1,11261740684_10154738207055685,data,fetched (200),53:18.8,Facebook:<page>/posts,"If you ask someone if they are thinking about suicide and they say yes, take the second step and #BeThe1To keep them safe. Separate them from anything they are thinking of using to hurt themselves. #NationalSuicidePreventionMonth",2017-09-07T14:41:45+0000
45,1,1,11261740684_10154736176960685,data,fetched (200),53:18.8,Facebook:<page>/posts,Missed our first #BeThe1To Twitter Chat yesterday? Don't worry! You can check out the chat here: https://storify.com/800273TALK/bethe1to-ask-and-be-there-2017 … #NSPM #Ask #BeThere,2017-09-06T17:45:49+0000
46,1,1,11261740684_10154734183340685,data,fetched (200),53:18.8,Facebook:<page>/posts,"#BeThe1To is more than just a hashtag.

Learn more at bethe1to.com.",2017-09-05T20:15:29+0000
47,1,1,11261740684_10154733775100685,data,fetched (200),53:18.8,Facebook:<page>/posts,"Join the Lifeline and other #mentalhealth organizations every Tuesday in September for #BeThe1To Twitter Chats.

Today's kickoff chat starts in less than 30 minutes! Join us at 2pm ET and follow along with #BeThe1To on Twitter. #NSPM",2017-09-05T17:43:06+0000
48,1,1,11261740684_10154733262270685,data,fetched (200),53:18.8,Facebook:<page>/posts,"In honor of #NationalSuicidePreventionMonth, the National Suicide Prevention Lifeline '1-800-273-TALK (8255)' will be releasing a series of graphics that'll list the 5 steps you can take to help someone in suicidal crisis. 

If you think someone might be considering #suicide, take the first step and #BeThe1To ask. Ask directly, ""Are you thinking about killing yourself?"" and listen without judgment.",2017-09-05T14:15:34+0000
49,1,1,11261740684_10154723011770685,data,fetched (200),53:18.8,Facebook:<page>/posts,‪Today kicks off National Suicide Prevention Month! What is #BeThe1To and what does it mean? Find out below! #NSPM ‬,2017-09-01T12:08:41+0000
50,1,1,11261740684_10154721176265685,data,fetched (200),53:18.8,Facebook:<page>/posts,Next month is #SuicidePreventionMonth! #BeThe1To play a role in suicide prevention. Here's how: http://bit.ly/2wbnQRW,2017-08-31T17:45:00+0000
51,1,1,11261740684_10154721163825685,data,fetched (200),53:18.8,Facebook:<page>/posts,"What a special moment for us on this year's MTV Video Music Awards! Thank you, Logic, for helping us spread awareness and sharing our lifesaving services.

""You are never alone."" 💚 
Call 1-800-273-TALK (8255).",2017-08-31T16:00:47+0000
52,1,1,11261740684_10154713885480685,data,fetched (200),53:18.8,Facebook:<page>/posts,"We are live! Watch Dr. John Draper, Director of the Lifeline, kick off our #BeThe1To campaign for the upcoming National Suicide Prevention month. bethe1to.com",2017-08-28T19:12:14+0000
54,1,1,11261740684_10154713777320685,data,fetched (200),53:19.1,Facebook:<page>/posts,"Our #BeThe1To kickoff will be LIVE on this page at 3 PM ET! Watch as Dr. John Draper, Director of the Lifeline, discusses why National Suicide Prevention Month matters and how you can participate.",2017-08-28T18:12:57+0000
55,1,1,11261740684_10154712522530685,data,fetched (200),53:19.1,Facebook:<page>/posts,"Whatever you're struggling with, you don't have to go through it alone. The Lifeline is here for you, 24/7, at 1-800-273-TALK (8255).",2017-08-28T03:28:18+0000
56,1,1,11261740684_10154711466445685,data,fetched (200),53:19.1,Facebook:<page>/posts,"Tonight, watch Logic perform ""1-800-273-8255"" on MTV's Video Music Awards at 8pm ET! Tell others to tune in and help us spread awareness. You are never alone. 💚",2017-08-27T18:04:18+0000
57,1,1,11261740684_10154708978435685,data,fetched (200),53:19.1,Facebook:<page>/posts,"Our sister crisis support service, the national Disaster Distress Helpline, provides free and confidential emotional support for people affected by #disaster. Reach out if you need someone to talk to: 1-800-985-5990. #HurricaneHarvey",2017-08-26T16:26:47+0000
58,1,1,11261740684_10154706438170685,data,fetched (200),53:19.1,Facebook:<page>/posts,"""But here's what's really important: Logic is generating calls with a song about getting help and finding hope."" - Dr. John Draper, Director of the Lifeline 

If you're struggling, reach out. The Lifeline is available 24/7/365 at 1-800-273-TALK (8255). 💚📲",2017-08-25T14:33:26+0000
59,1,1,11261740684_10154702150865685,data,fetched (200),53:19.1,Facebook:<page>/posts,"Looking for ways to get involved during next month's #SuicidePreventionMonth? To better disseminate the 5 #BeThe1To action steps to different audiences, the Lifeline is accepting customized versions of the 5 step graphics! Submit a graphic kit for a chance to be featured on bethe1to.com - learn how how here: http://bit.ly/2uJrpP5",2017-08-23T19:45:46+0000
60,1,1,11261740684_10154699278425685,data,fetched (200),53:19.1,Facebook:<page>/posts,Join us next month during #SuicidePreventionMonth as we encourage others to #BeThe1To help someone else. Learn how to participate here: http://bit.ly/2wbnQRW,2017-08-22T17:07:06+0000
61,1,1,11261740684_10154696804070685,data,fetched (200),53:19.1,Facebook:<page>/posts,"""I don't know, maybe I'm depressed or something,"" I type to my close friend on instant messenger. She doesn't cast me off. She doesn't view me differently. She doesn't push me away. She pulls me closer. She inspires me to continue to speak up. #BeThe1To #YouMatter",2017-08-21T16:51:52+0000
62,1,1,11261740684_10154684422570685,data,fetched (200),53:19.1,Facebook:<page>/posts,"If you're struggling right now, remember that the Lifeline is here for you, 24/7, at 1-800-273-TALK (8255). Let us help you through. 💚📲",2017-08-16T17:51:51+0000
63,1,1,11261740684_10154679221745685,data,fetched (200),53:19.1,Facebook:<page>/posts,"""Scars exist on people, for thousands of different reasons, and it is up to [them] to tell the stories of their own scars, when and how and to whom they choose."" #selfharm #youmatter",2017-08-14T20:15:53+0000
64,1,1,11261740684_10154666354110685,data,fetched (200),53:19.1,Facebook:<page>/posts,Tag a friend who needs to see this today. #YouMatter 💚,2017-08-09T15:48:09+0000
65,1,1,11261740684_10154664279370685,data,fetched (200),53:19.1,Facebook:<page>/posts,,2017-08-08T18:42:47+0000
66,1,1,11261740684_10154653557600685,data,fetched (200),53:19.1,Facebook:<page>/posts,The Mighty asked its community to share photos of Disney #tattoos they have that were inspired by their #mentalhealth journeys. Check them out below!,2017-08-04T17:48:50+0000
67,1,1,11261740684_10154651259810685,data,fetched (200),53:19.1,Facebook:<page>/posts,"Allowing for a safe space to talk about #mentalhealth issues may seem daunting or confusing, but it can be broken down to a few simple steps. Here are six ways to both create a safer environment for conversations about mental health and to aid existing conversations. #YouMatter",2017-08-03T20:11:32+0000
68,1,1,11261740684_10154648096015685,data,fetched (200),53:19.1,Facebook:<page>/posts,"""Too many people live in darkness and isolation, but all of us hold within ourselves the ability to offer a desperately needed lifeline.""

Visit bethe1to.com to learn more about how to help someone in crisis.",2017-08-02T16:11:22+0000
69,1,1,11261740684_10154645316280685,data,fetched (200),53:19.1,Facebook:<page>/posts,"If you're struggling, reach out. There is hope and there is help. The Lifeline is here for you, 24/7 at 1-800-273-TALK (8255).",2017-08-01T13:42:59+0000
70,1,1,11261740684_10154642910800685,data,fetched (200),53:19.1,Facebook:<page>/posts,"You are enough. If you find yourself struggling, remember that the Lifeline is here for you, 24/7, at 1-800-273-TALK (8255) if you need someone to talk to. 💜",2017-07-31T14:00:19+0000
71,1,1,11261740684_10154624680020685,data,fetched (200),53:19.1,Facebook:<page>/posts,"Struggling getting through the day? Call 1-800-273-TALK (8255) if you need someone to talk to. We're here for you, 24/7. 💚",2017-07-29T17:00:01+0000
72,1,1,11261740684_10154635199535685,data,fetched (200),53:19.1,Facebook:<page>/posts,,2017-07-28T12:50:16+0000
73,1,1,11261740684_10154633002180685,data,fetched (200),53:19.1,Facebook:<page>/posts,"African Americans and Hispanic Americans used mental health services at about half the rate of whites in the past year, and Asian Americans at about one-third the rate. Let’s change this! #MinorityMentalHealth 

https://www.nami.org/minoritymentalhealth",2017-07-27T17:33:14+0000
74,1,1,11261740684_10154624677690685,data,fetched (200),53:19.1,Facebook:<page>/posts,"Whatever you're going through, you don't have to go through it alone. The Lifeline is here for you, 24/7, at 1-800-273-TALK (8255).",2017-07-27T15:15:00+0000
75,1,1,11261740684_10154624676520685,data,fetched (200),53:19.1,Facebook:<page>/posts,Know someone going through a tough time? Share our inspirational #YouMatter Tumblr with them for a lift.,2017-07-25T14:00:01+0000
76,1,1,11261740684_10154624164815685,data,fetched (200),53:19.1,Facebook:<page>/posts,"""I'm not by any means cured. Healing doesn't work that way. I'm still struggling. I'm still fighting. But for the first time, I think I'm okay with that."" #YouMatter",2017-07-24T16:52:35+0000
77,1,1,11261740684_10154612115200685,data,fetched (200),53:19.1,Facebook:<page>/posts,"We're saddened to hear of the loss of Linkin Park lead singer, Chester Bennington. Please know that there is hope and there is help. If you're struggling emotionally, reach out and get support - the National Suicide Prevention Lifeline is available 24/7/365 at 1-800-273-TALK (8255).",2017-07-20T19:13:02+0000
78,1,1,11261740684_10154612046380685,data,fetched (200),53:19.1,Facebook:<page>/posts,"If you're struggling, reach out. There is hope and there is help. The Lifeline is here for you, 24/7 at 1-800-273-TALK (8255).",2017-07-20T18:48:28+0000
80,1,1,11261740684_10154603198905685,data,fetched (200),53:19.4,Facebook:<page>/posts,Take 5 minutes to download and share a Lifeline wallet card today! You might just save a life.,2017-07-17T20:57:20+0000
81,1,1,11261740684_10154582695515685,data,fetched (200),53:19.4,Facebook:<page>/posts,Introducing... our Summer/Fall You Matter Blogger Council! 'Like' this post to welcome the new You Matter bloggers who will be sharing their personal stories for the next few months to fight #stigma and prevent #suicide. Have a topic you want them to cover? Leave a note in the comments!,2017-07-11T19:16:52+0000
82,1,1,11261740684_10154582219915685,data,fetched (200),53:19.4,Facebook:<page>/posts,"When a web developer and engineer told her coworkers she was taking a few days off for her mental health, the CEO of her company replied - and his response was the best response ever. #MentalHealth #BeThe1To",2017-07-11T15:27:37+0000
83,1,1,11261740684_10154557619690685,data,fetched (200),53:19.4,Facebook:<page>/posts,"Thank you, Hayley Williams, for sharing your story. 💚 #Depression #MentalHealth",2017-07-03T18:57:47+0000
84,1,1,11261740684_10154546827140685,data,fetched (200),53:19.4,Facebook:<page>/posts,"As we head in to #4thOfJulyWeekend, remember that the Lifeline is here for you, 24/7, at 1-800-273-TALK (8255) if you need someone to talk to. ❤️💙",2017-06-30T16:48:02+0000
85,1,1,11261740684_10154543883570685,data,fetched (200),53:19.4,Facebook:<page>/posts,"""This is a project about life."" 📸",2017-06-29T17:47:11+0000
86,1,1,11261740684_10154540855345685,data,fetched (200),53:19.4,Facebook:<page>/posts,"""But hope is still there, even though it's out of sight. It might take a long time. You and I don't know when the day will come when you catch sight of that hope again. But that day is coming — I promise.""",2017-06-28T19:01:35+0000
87,1,1,11261740684_10154534275060685,data,fetched (200),53:19.4,Facebook:<page>/posts,Worried someone you know might be suicidal? You can #BeThe1To help. Here's how: http://bit.ly/2bLO6pa,2017-06-26T20:26:29+0000
88,1,1,11261740684_10154530518310685,data,fetched (200),53:19.4,Facebook:<page>/posts,"""This is not a post about embracing your #depression or letting it win. This is a post to say it's OK to have these times.""",2017-06-25T14:51:45+0000
89,1,1,11261740684_10154502813275685,data,fetched (200),53:19.4,Facebook:<page>/posts,Have an idea for a great #mentalhealth t-shirt? It's not too late to enter! Active Minds is accepting submissions until 6/21/17. Learn more about the contest here: http://bit.ly/2t7h0Z0,2017-06-15T20:59:02+0000
90,1,1,11261740684_10154494045975685,data,fetched (200),53:19.4,Facebook:<page>/posts,"""Thank you for understanding it never lasts and knowing that it will pass. Thank you too for knowing you may have to do it all again in a few months, weeks or even days.""",2017-06-13T15:34:34+0000
91,1,1,11261740684_10154486703830685,data,fetched (200),53:19.4,Facebook:<page>/posts,,2017-06-12T02:25:50+0000
92,1,1,11261740684_10154468028280685,data,fetched (200),53:19.4,Facebook:<page>/posts,Sending our Lifeline community a big group hug today! 💚,2017-06-05T14:50:18+0000
93,1,1,11261740684_10154466679755685,data,fetched (200),53:19.4,Facebook:<page>/posts,Find out why the 5 steps of #BeThe1To can help someone in crisis. http://bit.ly/2bDOxEj,2017-06-05T03:03:02+0000
94,1,1,11261740684_10154454482900685,data,fetched (200),53:19.4,Facebook:<page>/posts,"""Now I'm able to look back and say I survived. Now I'm able to look forward and say I can continue surviving and thriving.""",2017-06-01T15:27:35+0000
95,1,1,11261740684_10154452397220685,data,fetched (200),53:19.4,Facebook:<page>/posts,"Struggling getting through the day? Call 1-800-273-TALK (8255) if you need someone to talk to. We're here for you, 24/7. 💚📲",2017-05-31T20:44:18+0000
96,1,1,11261740684_10154449465080685,data,fetched (200),53:19.4,Facebook:<page>/posts,"""I sought to write something others could relate to, but I was nervous. This was how I felt about many things in life: I wanted to do it, but I was fearful."" #Anxiety",2017-05-30T18:53:40+0000
97,1,1,11261740684_10154447363035685,data,fetched (200),53:19.4,Facebook:<page>/posts,"Check out a discussion on Military active and Vet communities' mental health, substance use and suicide prevention with The You Rock Foundation and Ryan Hampton. #MemorialDay",2017-05-29T23:03:18+0000
98,1,1,11261740684_10154446327640685,data,fetched (200),53:19.4,Facebook:<page>/posts,"If today is a difficult day for you or if you lost a loved one in active duty, remember that the Lifeline is here for you, 24/7 at 1-800-273-TALK (8255). #MemorialDay 🇺🇸❤️💙",2017-05-29T15:48:18+0000
99,1,1,11261740684_10154432904800685,data,fetched (200),53:19.4,Facebook:<page>/posts,"Listen to the National Action Alliance for Suicide Prevention, Congressman John Katko, and Dr. John Draper, Director of the National Suicide Prevention Lifeline '1-800-273-TALK (8255)', as they discuss #suicideprevention and #crisiscare. #MentalHealthMonth",2017-05-24T19:03:17+0000
100,1,1,11261740684_10154430532235685,data,fetched (200),53:19.4,Facebook:<page>/posts,"""For me, there were a lot. I started sleeping less. I stopped singing and I stopped exercising. I stopped taking care of myself and it was hard getting up in the morning."" #Depression #MentalHealthMonth",2017-05-23T20:19:03+0000
101,1,1,11261740684_10154430524965685,data,fetched (200),53:19.4,Facebook:<page>/posts,,2017-05-23T20:14:08+0000
102,1,1,11261740684_10154417109190685,data,fetched (200),53:19.4,Facebook:<page>/posts,"We're saddened to hear of the loss of Chris Cornell. If you're struggling emotionally, please know you don't have to work through it alone. We want to help. Reach out and get support - the National Suicide Prevention Lifeline is available 24/7/365 at 1-800-273-TALK (8255).",2017-05-18T19:12:58+0000
103,1,1,11261740684_10154411826490685,data,fetched (200),53:19.4,Facebook:<page>/posts,,2017-05-16T19:18:30+0000
104,1,1,11261740684_10154407890180685,data,fetched (200),53:19.4,Facebook:<page>/posts,"Thank you, Elvis Duran Show, for helping us spread awareness about this very important topic! #SuicidePrevention #MentalHealthMonth",2017-05-15T16:28:25+0000
106,1,1,11261740684_10154407454995685,data,fetched (200),53:19.4,Facebook:<page>/posts,"‪As we start a new week, remember that the Lifeline is here for anyone struggling with difficult emotions - you do not have to be thinking about suicide to call. Let us help you through: 1-800-273-TALK (8255)",2017-05-15T12:59:14+0000
107,1,1,11261740684_10154399934035685,data,fetched (200),53:19.4,Facebook:<page>/posts,"This weekend, #BeThe1To be there for someone else.

bethe1to.com",2017-05-12T17:33:28+0000
108,1,1,11261740684_10154397199170685,data,fetched (200),53:19.4,Facebook:<page>/posts,"Hannah Daisy, a #mentalhealth occupational therapist, created #boringselfcare – a series of illustrations highlighting less than luxurious self-care tasks like doing the dishes, getting dressed, household chores and other personal items to help others understand that #selfcare isn't just bubble baths and massages.",2017-05-11T16:58:56+0000
109,1,1,11261740684_10154395050835685,data,fetched (200),53:19.4,Facebook:<page>/posts,"Thank you, Instagram, for raising awareness about #mentalhealth and the importance of finding support. #MentalHealthMonth",2017-05-10T20:01:43+0000
110,1,1,11261740684_10154389436315685,data,fetched (200),53:19.4,Facebook:<page>/posts,"The Lifeline is happy to work alongside Logic to let everyone know that hope and help are out there. Thank you for spreading awareness through your music, and for sharing our lifesaving resource.",2017-05-08T17:40:59+0000
111,1,1,11261740684_10154388833480685,data,fetched (200),53:19.4,Facebook:<page>/posts,"""A single person's actions can have an enormous impact to a person in crisis. Often, we don't know what actions to take. We're afraid of doing the wrong thing. We are afraid of saying the wrong thing. But when someone you care about is suicidal, taking action to help is the best thing you can do."" - Kevin Hines #BeThe1To",2017-05-08T14:03:12+0000
112,1,1,11261740684_10154387919225685,data,fetched (200),53:19.4,Facebook:<page>/posts,"Whatever you're going through, you don't have to go through it alone. The Lifeline is here for you, 24/7, at 1-800-273-TALK (8255).",2017-05-08T04:06:01+0000
113,1,1,11261740684_10154381485890685,data,fetched (200),53:19.4,Facebook:<page>/posts,,2017-05-05T17:29:58+0000
114,1,1,11261740684_10154378969510685,data,fetched (200),53:19.4,Facebook:<page>/posts,,2017-05-04T18:34:01+0000
115,1,1,11261740684_10154375773605685,data,fetched (200),53:19.4,Facebook:<page>/posts,"Are you watching? Interesting discussion about #13ReasonsWhy on Mental Health America, happening now!",2017-05-03T15:38:59+0000
116,1,1,11261740684_10154372948475685,data,fetched (200),53:19.4,Facebook:<page>/posts,"Check out The Mighty's #MentalHealthMonth campaign, ""31 Days of Voices."" Every day this month, a different mental health advocate will go live on the Mental Health on The Mighty Facebook page to show just how diverse and amazing and real the #mentalhealth community is.",2017-05-02T20:09:41+0000
117,1,1,11261740684_10154370268130685,data,fetched (200),53:19.4,Facebook:<page>/posts,"Have you applied to be on our youth You Matter blogger council yet? Applications are due THIS Friday, 5/5! 📝 

Apply today. #mentalhealthmonth",2017-05-01T18:17:16+0000
118,1,1,11261740684_10154369585245685,data,fetched (200),53:19.4,Facebook:<page>/posts,"""Logic's message is a constant reminder that there is life after the struggle, and you can be happy. There is happiness after the struggle."" #800273TALK",2017-05-01T14:02:46+0000
119,1,1,11261740684_10154362808040685,data,fetched (200),53:19.4,Facebook:<page>/posts,"""I wasn't even trying to save your life, now what could happen if I actually did?"" Watch Logic explain the lyrics of his latest single, '1-800-273-8255' and why he felt compelled to write it.",2017-04-28T21:51:49+0000
120,1,1,11261740684_10154361900350685,data,fetched (200),53:19.4,Facebook:<page>/posts,"Logic just dropped his latest single, '1-800-273-8255,' off of his new album! We thank him for spreading hope and awareness through his music and for giving a voice to those who are struggling. Thank you to Alessia Cara and Khalid, too, who are also featured in the song. You can listen to it in the link below. Help us spread this very important message: that hope & help are out there 💚",2017-04-28T14:44:46+0000
121,1,1,11261740684_10154359363730685,data,fetched (200),53:19.4,Facebook:<page>/posts,"Thank you, Logic, for opening up about your own struggles and for spreading hope and awareness through your music. We hope this very important message reaches anyone who needs it.

The Lifeline is here 24/7/365 at 1-800-273-TALK (8255).",2017-04-27T15:20:15+0000
122,1,1,11261740684_10154357160640685,data,fetched (200),53:19.4,Facebook:<page>/posts,"Hey, youth bloggers! It's that time again. We're looking for writers to join our 2017 Spring/Summer You Matter Blogger Council. Applications are due by Friday, May 5th, 2017. Apply today!",2017-04-26T17:45:53+0000
123,1,1,11261740684_10154354185000685,data,fetched (200),53:19.4,Facebook:<page>/posts,"""I was a skeptic before I began #therapy. I thought sitting down and talking about deep rooted emotional problems for an hour a week was silly. But my first session was an interesting experience...I felt like he was genuinely trying to help me.""",2017-04-25T20:21:35+0000
124,1,1,11261740684_10154341103790685,data,fetched (200),53:19.4,Facebook:<page>/posts,Watching Netflix's '13 Reasons Why'? Here are some important talking points about #teensuicide from The Jed Foundation and Suicide Awareness Voices of Education: http://bit.ly/2ojt0r7,2017-04-20T19:52:30+0000
125,1,1,11261740684_10154335467180685,data,fetched (200),53:19.4,Facebook:<page>/posts,"In honor of National Poetry Month, The Mighty is celebrating modern poets who've put #mentalillness and #mentalhealth in the spotlight.",2017-04-18T20:33:21+0000
126,1,1,11261740684_10154332101105685,data,fetched (200),53:19.4,Facebook:<page>/posts,"Whatever you're going through, you don't have to go through it alone. The Lifeline is here for you, 24/7, at 1-800-273-TALK (8255).",2017-04-17T15:36:52+0000
127,1,1,11261740684_10154323671275685,data,fetched (200),53:19.4,Facebook:<page>/posts,"As we head in to the weekend, be sure to schedule in some time for #selfcare.

And remember, if you ever need someone to talk to, the Lifeline is here for you, 24/7 at 1-800-273-TALK (8255). You do not have to be thinking about suicide to call us. We help anyone struggling emotionally. ☎️💚",2017-04-14T17:49:03+0000
128,1,1,11261740684_10154320629250685,data,fetched (200),53:19.4,Facebook:<page>/posts,Bridge barriers can save lives. Congrats Golden Gate Bridge on this historic moment! See our position paper on #suicide and bridges here: http://bit.ly/2ow7BtI,2017-04-13T19:07:21+0000
129,1,1,11261740684_10154317913995685,data,fetched (200),53:19.4,Facebook:<page>/posts,"Struggling getting through the day? Call 1-800-273-TALK (8255) if you need someone to talk to. We're here for you, 24/7. 💚📲",2017-04-12T22:46:58+0000
130,1,1,11261740684_10154314155245685,data,fetched (200),53:19.4,Facebook:<page>/posts,"""I spent a long period of time believing that I was different or malfunctioning. Then one day an old friend told me: 'You are not your disorder. You are not broken. There is nothing wrong with you. This is who you are, and this is what makes you so amazing.'""",2017-04-11T18:22:56+0000
1710,130,2,10154314155245685_10154316565180685,data,fetched (200),44:05.1,Facebook:<post>/comments,Thanks every one for sharing or liking our posts.  We are here 24/7/365  '1-800-273-TALK (8255)',2017-04-12T13:23:32+0000
