id,parent_id,level,objectid,objecttype,querystatus,querytime,querytype,message,created_time
1149,83,2,10154557619690685_10154610218085685,data,fetched (200),55:47.3,Facebook:<post>/comments,Heith D Parker,2017-07-20T03:27:35+0000
1150,83,2,10154557619690685_10154557690865685,data,fetched (200),55:47.3,Facebook:<post>/comments,Ashley Sullivan 💘 love her.,2017-07-03T19:22:30+0000
1152,84,2,10154546827140685_10154557184845685,data,fetched (200),55:51.1,Facebook:<post>/comments,"Thank you to everyone sharing and engaging with this post! If you need someone to talk to, remember that the Lifeline is here for you any time day or night, every day of the year at 1-800-273-TALK (8255). Your life matters!",2017-07-03T16:14:33+0000
1153,84,2,10154546827140685_10154546833935685,data,fetched (200),55:51.1,Facebook:<post>/comments,#4thOfJulyWeekend was the weekend my father finalized his will in preparation for his suicide on July 15th. It will soon be five years since that horrible day. I may end up calling.,2017-06-30T16:51:45+0000
1154,84,2,10154546827140685_10154547444210685,data,fetched (200),55:51.1,Facebook:<post>/comments,I'm not a counselor but here I'm here if anyone needs to talk. I've been dealing with depression all of my life so I know a little about the struggles.,2017-06-30T20:16:52+0000
1155,84,2,10154546827140685_10154550064205685,data,fetched (200),55:51.1,Facebook:<post>/comments,I'm ok I have someone here now it's day time. Thank you ! You get me through the nights!! God bless people like you!,2017-07-01T15:01:29+0000
1156,84,2,10154546827140685_10154547220865685,data,fetched (200),55:51.1,Facebook:<post>/comments,God Bless all who have been affected by suicide.,2017-06-30T18:42:05+0000
1157,84,2,10154546827140685_10154547056335685,data,fetched (200),55:51.1,Facebook:<post>/comments,"Anyone want someone to talk to or just want a friend, drop me a message or send me a friend request.",2017-06-30T17:37:19+0000
1158,84,2,10154546827140685_10154601617890685,data,fetched (200),55:51.1,Facebook:<post>/comments,"I'm deaf all I have is my phone I need someone to talk to, I don't want to be hear anymore. I feel so sad.",2017-07-17T08:10:25+0000
1159,84,2,10154546827140685_10154548986605685,data,fetched (200),55:51.1,Facebook:<post>/comments,My nephews fiancé just got the call nobody ever wants to get.,2017-07-01T07:22:10+0000
1160,84,2,10154546827140685_10154547863460685,data,fetched (200),55:51.1,Facebook:<post>/comments,The suicide prevention lifeline is very good to talk to,2017-06-30T22:47:38+0000
1161,84,2,10154546827140685_10154549693765685,data,fetched (200),55:51.1,Facebook:<post>/comments,"#4thofJulyWeekend, 1-800-273-TALK...if you need someone to talk to. ❤️💙🖤",2017-07-01T13:16:45+0000
1162,84,2,10154546827140685_10154560867985685,data,fetched (200),55:51.1,Facebook:<post>/comments,I'm happy I have family or things would be different I'm tired of struggling life has thrown me a few to many hard balls and suicide enters my mind all to much I struggle every day my family is my rock Bh Care is my rock,2017-07-04T15:42:16+0000
1163,84,2,10154546827140685_10154549166785685,data,fetched (200),55:51.1,Facebook:<post>/comments,Check ignited in Christ healing ministeries and dr mk strydom Eagle wings ministry,2017-07-01T09:15:52+0000
1164,84,2,10154546827140685_10154548169310685,data,fetched (200),55:51.1,Facebook:<post>/comments,*and Canada day weekend as well,2017-07-01T00:54:43+0000
1165,84,2,10154546827140685_10154555129015685,data,fetched (200),55:51.1,Facebook:<post>/comments,"Peace be with you, Susan.",2017-07-03T00:23:59+0000
1166,84,2,10154546827140685_10154553194670685,data,fetched (200),55:51.1,Facebook:<post>/comments,Thank you,2017-07-02T12:42:18+0000
1168,85,2,10154543883570685_10154544427385685,data,fetched (200),55:55.1,Facebook:<post>/comments,"Hi everyone! Thanks for sharing or liking our posts. We are here 24/7 for anyone who needs to talk, just call us!",2017-06-29T21:27:20+0000
1169,85,2,10154543883570685_10154544440015685,data,fetched (200),55:55.1,Facebook:<post>/comments,Thanks for tagging me Stacey Ridenour I am so proud to be part of this awesome project!!,2017-06-29T21:30:49+0000
1170,85,2,10154543883570685_10154544028855685,data,fetched (200),55:55.1,Facebook:<post>/comments,This is powerful...shining light on the dark...thank you for sharing this,2017-06-29T18:51:17+0000
1171,85,2,10154543883570685_10154544434475685,data,fetched (200),55:55.1,Facebook:<post>/comments,Vanessa Stalets McDaniel,2017-06-29T21:29:27+0000
1173,86,2,10154540855345685_10154562287450685,data,fetched (200),55:59.6,Facebook:<post>/comments,"Jennifer Davisi.Life may seem meaningless now, but we want to help you find hope. The Lifeline’s crisis counselors are here for you any time day or night at 1-800-273-TALK (8255). Your life matters!",2017-07-05T01:01:39+0000
1174,86,2,10154540855345685_10154542945615685,data,fetched (200),55:59.6,Facebook:<post>/comments,"To those of you contemplating suicide and to those of you I see here thinking loudly about it, I wish I could ease your pain, I have never met you, but if I could, I WOULD!! I have been thinking it for about 20 years and the 1 thing that I keep thinking about is what someone told me, is that you will miss out on the rest of your life and that all the troubles you have will be gone, but you are strong enough to keep fighting for yourself! It might seem like it will be an end for you, but what about those of us that are bound to meet you in our lifetime?",2017-06-29T11:40:01+0000
1175,86,2,10154540855345685_10154541692770685,data,fetched (200),55:59.6,Facebook:<post>/comments,"Three months of it now, use to come and go, but three months solid. But I'm use to it now. Just gotta keep it down.",2017-06-29T00:28:06+0000
1176,86,2,10154540855345685_10154540884065685,data,fetched (200),55:59.6,Facebook:<post>/comments,Nice to have someone listen and make some suggestions!🖒,2017-06-28T19:14:29+0000
1177,86,2,10154540855345685_10154541767895685,data,fetched (200),55:59.6,Facebook:<post>/comments,That was much needed.,2017-06-29T01:01:35+0000
1178,86,2,10154540855345685_10154613510475685,data,fetched (200),55:59.6,Facebook:<post>/comments,Thanks a lot,2017-07-21T06:12:00+0000
1179,86,2,10154540855345685_10154541120115685,data,fetched (200),55:59.6,Facebook:<post>/comments,,2017-06-28T20:59:16+0000
1180,86,2,10154540855345685_10154541176760685,data,fetched (200),55:59.6,Facebook:<post>/comments,Believe.  This will pass.,2017-06-28T21:15:09+0000
1181,86,2,10154540855345685_10154542100005685,data,fetched (200),55:59.6,Facebook:<post>/comments,Thanks for sharing this.,2017-06-29T04:04:30+0000
1182,86,2,10154540855345685_10154729307565685,data,fetched (200),55:59.6,Facebook:<post>/comments,Rayan Antoun,2017-09-03T23:10:09+0000
1184,87,2,10154534275060685_10154534790825685,data,fetched (200),56:05.4,Facebook:<post>/comments,Friend or complete strangers... I follow this page for a reason... I'm here to talk... or listen.... possibly make a new friend. Suicide prevention.... awareness....,2017-06-26T23:56:35+0000
1185,87,2,10154534275060685_10154545817090685,data,fetched (200),56:05.4,Facebook:<post>/comments,"As a good swedish author called Tomas Gunnarson says practise to dare your daremuscle. To feel better, follow your dreams, break old habits, try new things,daree to ask for help, dareee to fail and learn from it, darer to grow and change and learn,daree to improve and succeed, daree to speakup for yourself and others",2017-06-30T08:33:24+0000
1186,87,2,10154534275060685_10154545811865685,data,fetched (200),56:05.4,Facebook:<post>/comments,You can follow your dreamsby finding a good freelancing website aand/or finding a good webbforum and join and eventually volunteer for free and see were it Leads and perhaps find a workshop or a  group for it near you and many other ways always protect tour personal info,2017-06-30T08:29:20+0000
1187,87,2,10154534275060685_10154536130655685,data,fetched (200),56:05.4,Facebook:<post>/comments,"Unfortunately, I have lost a relative recently due to suicide. I immediately chose to be proactive and have signed up for a walk in October, found your page and others online, and have been researching what to do in case someone calls me for help (and I pray they do!). Thank you for helping people like me and saving those who reach out. Thank you!",2017-06-27T13:07:46+0000
1188,87,2,10154534275060685_10154541685445685,data,fetched (200),56:05.4,Facebook:<post>/comments,Suicide is the second highest cause of death in ten to twenty four year olds.,2017-06-29T00:24:21+0000
1189,87,2,10154534275060685_10154534793360685,data,fetched (200),56:05.4,Facebook:<post>/comments,love this,2017-06-26T23:57:16+0000
1190,87,2,10154534275060685_10154535459660685,data,fetched (200),56:05.4,Facebook:<post>/comments,Shared!,2017-06-27T05:59:50+0000
1191,87,2,10154534275060685_10154535259785685,data,fetched (200),56:05.4,Facebook:<post>/comments,Marlene Gonzalezraya,2017-06-27T04:32:34+0000
1192,87,2,10154534275060685_10154644787280685,data,fetched (200),56:05.4,Facebook:<post>/comments,June Napoli,2017-08-01T07:15:58+0000
1194,88,2,10154530518310685_10154530944785685,data,fetched (200),10/13/2017 22:56,Facebook:<post>/comments,thank you for those words 'it's ok to have those times' helped me to immediately feel a bit better.,2017-06-25T18:01:04+0000
1195,88,2,10154530518310685_10154530884075685,data,fetched (200),10/13/2017 22:56,Facebook:<post>/comments,"Going through this now. I can't even bother to shower. Just sitting around doing nothing. And, I feel so guilty 😔",2017-06-25T17:34:43+0000
1196,88,2,10154530518310685_10154530608515685,data,fetched (200),10/13/2017 22:56,Facebook:<post>/comments,Sure would love to see an effort to reach middle schoolers!,2017-06-25T15:34:34+0000
1197,88,2,10154530518310685_10154530674265685,data,fetched (200),10/13/2017 22:56,Facebook:<post>/comments,I've struggled for years with depression and anxiety. Finally got my meds sorted. When the day is a bad one I'm trying to learn to accept it.It's a lonely illness tho.,2017-06-25T16:04:53+0000
1198,88,2,10154530518310685_10154530554790685,data,fetched (200),10/13/2017 22:56,Facebook:<post>/comments,"I'm on Prozac for depression now, and it puts me in a euphoric state...But I know there are times that the depression and frowns are still there",2017-06-25T15:10:46+0000
1199,88,2,10154530518310685_10154531937685685,data,fetched (200),10/13/2017 22:56,Facebook:<post>/comments,I've struggled with moments of depression and loneliness since my Dad died of suicide March 2016. I miss him alot. It's a fight everyday but worth it. Want to make him proud.,2017-06-25T23:57:04+0000
1200,88,2,10154530518310685_10154535298825685,data,fetched (200),10/13/2017 22:56,Facebook:<post>/comments,I recently lost a friend to suicide. I'm going to do the walk for suicide prevention on October 28 in San Diego,2017-06-27T05:03:37+0000
1201,88,2,10154530518310685_10154532358150685,data,fetched (200),10/13/2017 22:56,Facebook:<post>/comments,This is eerie that it popped up today. I needed to read this so much.,2017-06-26T03:50:32+0000
1202,88,2,10154530518310685_10154532061945685,data,fetched (200),10/13/2017 22:56,Facebook:<post>/comments,"I take my medication as prescribed.  However, I occasionally have a day or two when I cannot get motivated.
I have recently noticed that if I can get myself to take a shower, I can get through the day and accomplish what I need to.",2017-06-26T00:55:54+0000
1203,88,2,10154530518310685_10154532238795685,data,fetched (200),10/13/2017 22:56,Facebook:<post>/comments,I got through it with no support. Calling this phone number just to talk to someone was very helpful.,2017-06-26T02:22:43+0000
1204,88,2,10154530518310685_10154532726355685,data,fetched (200),10/13/2017 22:56,Facebook:<post>/comments,Remember that JESUS loves you,2017-06-26T08:01:59+0000
1205,88,2,10154530518310685_10154530737065685,data,fetched (200),10/13/2017 22:56,Facebook:<post>/comments,I've been sunk in bed for a week now. I hate life 😥!,2017-06-25T16:35:53+0000
1206,88,2,10154530518310685_10154531370530685,data,fetched (200),10/13/2017 22:56,Facebook:<post>/comments,"Great conversation folks, it's good to hear your suggestions, if you have programs that are working Id like to hear them.

Having room to share these messages is definitely reaching some people, even one, is an answer to a 20 year old prayer 🙏",2017-06-25T20:37:41+0000
1207,88,2,10154530518310685_10154531845165685,data,fetched (200),10/13/2017 22:56,Facebook:<post>/comments,"""Putting a war face on""
🙌🏻
All day everyday!",2017-06-25T23:03:20+0000
1208,88,2,10154530518310685_10154530533330685,data,fetched (200),10/13/2017 22:56,Facebook:<post>/comments,Thank you.,2017-06-25T15:00:20+0000
1209,88,2,10154530518310685_10154530570430685,data,fetched (200),10/13/2017 22:56,Facebook:<post>/comments,Thank you for this,2017-06-25T15:18:13+0000
1210,88,2,10154530518310685_10154531936970685,data,fetched (200),10/13/2017 22:56,Facebook:<post>/comments,Right,2017-06-25T23:56:36+0000
1211,88,2,10154530518310685_10154530525300685,data,fetched (200),10/13/2017 22:56,Facebook:<post>/comments,Thank you,2017-06-25T14:55:38+0000
1212,88,2,10154530518310685_10154530531860685,data,fetched (200),10/13/2017 22:56,Facebook:<post>/comments,Shannon Stivers,2017-06-25T14:59:33+0000
1213,88,2,10154530518310685_10154532237235685,data,fetched (200),10/13/2017 22:56,Facebook:<post>/comments,I didn't read this but it is OK. Especially during hard times. I'm not depressed I've just been through a lot and still am going though a lot. I hope that she is OK.,2017-06-26T02:21:41+0000
1215,89,2,10154502813275685_10154513822075685,data,fetched (200),56:17.6,Facebook:<post>/comments,"RAINEAR-TrentonNJ,Inc.  Thanks for the encouraging words.  National Suicide Prevention Lifeline: 1-800-273-TALK. The call is free and confidential, and crisis workers are there 24/7 to assist anyone in need",2017-06-19T14:29:13+0000
1216,89,2,10154502813275685_10154503367800685,data,fetched (200),56:17.6,Facebook:<post>/comments,Control It -Don't Let It Control You,2017-06-16T00:32:48+0000
1217,89,2,10154502813275685_10154506144030685,data,fetched (200),56:17.6,Facebook:<post>/comments,Stacy Michele,2017-06-16T22:04:48+0000
1219,90,2,10154494045975685_10154498043575685,data,fetched (200),56:21.3,Facebook:<post>/comments,"Thanks everyone for sharing our posts!!.  Our crisis counselors are here for you any time day or night, every day of the year at 1-800-273-TALK (8255).",2017-06-14T13:12:56+0000
1220,90,2,10154494045975685_10154628574270685,data,fetched (200),56:21.3,Facebook:<post>/comments,"A partner can only put up with so much for so long. It's not fair to put the people you love! threw this, time after time. It makes you feel even worse knowing your hurting your wife and it becomes very hard to hide it from your kids. It's not fair to your family that you are causing of all this pain. So you put on that fake smile and laugh for all your friends,(The ones you still have, because you've pushed everyone away so you don't hurt them too) for all these years. But you know it's slowly killing your partner inside, until they can't be with you anymore. And it's your fault for causing sadness and killing the last thing you ever cared about, and there's not many thing left you care about,  or imagined you would cause... you always hope for the sun and hope and pray that it will stay longer then it does. It would be better for everyone you touch in life.",2017-07-26T03:25:18+0000
1221,90,2,10154494045975685_10154498742495685,data,fetched (200),56:21.3,Facebook:<post>/comments,Thank you Ben Godfrey for always bandaging up my wounds... my heart and on my wrist.,2017-06-14T16:58:10+0000
1222,90,2,10154494045975685_10154796414850685,data,fetched (200),56:21.3,Facebook:<post>/comments,Lisa Luna Thank You. Your my everything!,2017-10-01T21:56:34+0000
1223,90,2,10154494045975685_10154629429740685,data,fetched (200),56:21.3,Facebook:<post>/comments,You ok buddy? Call me if you need me!!,2017-07-26T13:00:58+0000
1224,90,2,10154494045975685_10154497785020685,data,fetched (200),56:21.3,Facebook:<post>/comments,Beautiful,2017-06-14T11:29:00+0000
1225,90,2,10154494045975685_10154496768010685,data,fetched (200),56:21.3,Facebook:<post>/comments,In Australia it's lifeline on 13 11 14,2017-06-14T03:34:20+0000
1226,90,2,10154494045975685_10154500333065685,data,fetched (200),56:21.3,Facebook:<post>/comments,,2017-06-15T01:31:58+0000
1227,90,2,10154494045975685_10154507248990685,data,fetched (200),56:21.3,Facebook:<post>/comments,❤️,2017-06-17T08:36:02+0000
1228,90,2,10154494045975685_10154494101145685,data,fetched (200),56:21.3,Facebook:<post>/comments,Thank u Cellus Cee,2017-06-13T15:49:41+0000
1229,90,2,10154494045975685_10154495638580685,data,fetched (200),56:21.3,Facebook:<post>/comments,Liberty Zhang,2017-06-13T21:07:16+0000
1231,91,2,10154486703830685_10154488010625685,data,fetched (200),56:30.9,Facebook:<post>/comments,"The National Suicide Prevention Lifeline '1-800-273-TALK (8255)', is here 24/7/365.  You do not have to be thinking about suicide to call the Lifeline. Our crisis counselors are here for anyone struggling through a hard time or needing advice.",2017-06-12T13:09:53+0000
1232,91,2,10154486703830685_10154487485625685,data,fetched (200),56:30.9,Facebook:<post>/comments,There's always someone to help you.no matter what.please please get help. Thank you.,2017-06-12T10:04:48+0000
1234,92,2,10154468028280685_10154473900955685,data,fetched (200),56:35.3,Facebook:<post>/comments,Thanks everyone for sharing our posts!). The lifeline is here for everyone 24/7/365 at 1-800-273-TALK (8255). For more information about suicide prevention please visit our main website at www.suicidepreventionlifeline.org,2017-06-07T13:11:15+0000
1235,92,2,10154468028280685_10154469438935685,data,fetched (200),56:35.3,Facebook:<post>/comments,Here for support towards anyone reading this that needs it. ((((Hugs)))),2017-06-06T00:59:50+0000
1236,92,2,10154468028280685_10154469112220685,data,fetched (200),56:35.3,Facebook:<post>/comments,,2017-06-05T22:27:55+0000
1237,92,2,10154468028280685_10154472437205685,data,fetched (200),56:35.3,Facebook:<post>/comments,Yep some Mondays are just like that.....,2017-06-06T23:22:53+0000
1238,92,2,10154468028280685_10154468611515685,data,fetched (200),56:35.3,Facebook:<post>/comments,I need one,2017-06-05T19:20:21+0000
1239,92,2,10154468028280685_10154468799875685,data,fetched (200),56:35.3,Facebook:<post>/comments,I need one 2,2017-06-05T20:28:02+0000
1240,92,2,10154468028280685_10154468879540685,data,fetched (200),56:35.3,Facebook:<post>/comments,Couldn't we all,2017-06-05T21:08:29+0000
1241,92,2,10154468028280685_10154484629440685,data,fetched (200),56:35.3,Facebook:<post>/comments,,2017-06-11T11:09:38+0000
1242,92,2,10154468028280685_10154484627520685,data,fetched (200),56:35.3,Facebook:<post>/comments,,2017-06-11T11:08:37+0000
1243,92,2,10154468028280685_10154469520455685,data,fetched (200),56:35.3,Facebook:<post>/comments,,2017-06-06T01:52:34+0000
1244,92,2,10154468028280685_10154472571785685,data,fetched (200),56:35.3,Facebook:<post>/comments,Loren SmithWest,2017-06-07T00:30:29+0000
1246,93,2,10154466679755685_10154474872900685,data,fetched (200),56:39.5,Facebook:<post>/comments,Thanks everyone for sharing our posts!,2017-06-07T19:56:47+0000
1247,93,2,10154466679755685_10154469495495685,data,fetched (200),56:39.5,Facebook:<post>/comments,Better to go ahead and ask if one needs to talk or needs help immediately... also just listen.. no judgement... just a listening ear and shoulder to lean on,2017-06-06T01:36:17+0000
1248,93,2,10154466679755685_10154607260990685,data,fetched (200),56:39.5,Facebook:<post>/comments,Mina Flores 💕,2017-07-19T04:06:57+0000
1250,94,2,10154454482900685_10154456142945685,data,fetched (200),57:00.6,Facebook:<post>/comments,Please know that everyone's life has value. The lifeline (1-800-273-TALK) is an amazing resource. They are there to offer hope and help you. ❤️❤️❤️,2017-06-02T04:53:51+0000
1251,94,2,10154454482900685_10154455480085685,data,fetched (200),57:00.6,Facebook:<post>/comments,For everybody hating birthdays you should sign up for all of the freebies you get from restaurants. I have a week long celebration every summer!,2017-06-01T23:05:24+0000
1252,94,2,10154454482900685_10154455542455685,data,fetched (200),57:00.6,Facebook:<post>/comments,I'm glad you survived and able to talk about. I love you.,2017-06-01T23:35:42+0000
1253,94,2,10154454482900685_10154456557860685,data,fetched (200),57:00.6,Facebook:<post>/comments,Do you need training or a degree to work as a hot line advocate,2017-06-02T09:25:20+0000
1254,94,2,10154454482900685_10154456046285685,data,fetched (200),57:00.6,Facebook:<post>/comments,"That cake looks amazing. Be good, friends.",2017-06-02T03:38:05+0000
1255,94,2,10154454482900685_10154612366890685,data,fetched (200),57:00.6,Facebook:<post>/comments,🌅🌅🌅,2017-07-20T20:53:13+0000
1257,95,2,10154452397220685_10154453109675685,data,fetched (200),57:04.5,Facebook:<post>/comments,"I'm prednisone dependent and the drug is taking me out emotionally. Doctors won't let me get off it because I can die, but they don't listen on it I will die too. Prednisone helps me breathe but at what cost at this point. And do I care anymore.",2017-06-01T02:17:38+0000
1258,95,2,10154452397220685_10154509531590685,data,fetched (200),57:04.5,Facebook:<post>/comments,Today's one of those days...Days like this I'm thankful there's only 24hrs in a day...,2017-06-18T03:08:37+0000
1259,95,2,10154452397220685_10154452752640685,data,fetched (200),57:04.5,Facebook:<post>/comments,I'm available to talk if anyone is interested.,2017-05-31T23:06:38+0000
1260,95,2,10154452397220685_10154596365970685,data,fetched (200),57:04.5,Facebook:<post>/comments,Sometimes I feel I can't talk to anyone,2017-07-15T15:20:43+0000
1261,95,2,10154452397220685_10154453630435685,data,fetched (200),57:04.5,Facebook:<post>/comments,Hello,2017-06-01T06:47:08+0000
1262,95,2,10154452397220685_10154454238240685,data,fetched (200),57:04.5,Facebook:<post>/comments,@ha ppy,2017-06-01T13:44:13+0000
1263,95,2,10154452397220685_10154461153415685,data,fetched (200),57:04.5,Facebook:<post>/comments,Yupppppppp,2017-06-03T18:05:00+0000
1265,96,2,10154449465080685_10154451349950685,data,fetched (200),57:08.8,Facebook:<post>/comments,"Thanks everyone for sharing our posts!.  If you are struggling with tough emotions please call us at 1-800-273-TALK (8255). The Lifeline is here for you, your friend, or anyone struggling through hard times - 24/7/365. Feel free to pass along our phone number.",2017-05-31T13:26:57+0000
1266,96,2,10154449465080685_10154450795380685,data,fetched (200),57:08.8,Facebook:<post>/comments,"Hi. I want to share my moment. At times i was okay and thought i can go out and abiut in the community l live at...one day l went out to luch with a my life long friend; wr got to the deli and there were 3 people i knew, they said hello to me and next i went from being okay to anxiety inside myself. I responded within me...oh my shaking inside and went tp say hi and hugged them. I caught up to my friend and said....""l have to go back to the truck."" I can't be here. Having a moment of fear, the 3 people o seen was 3 people too many. I was shaking and went right back out and had to calm myself.
 The sharing is that i can be alright then in an instant not alright. That is my unexpected anxiety moment. Do not know why that happened. I felr safe on the truck again away from all. My friend csme back with our lunch and helped me by just listening to me. We eent for a ride. 
That is my share on my anxiety visit. If i feel i can't go out anf about in my small community then i stay in until o feel ready. This moment was mid of last year.
 Since i am doing okay. It is a scary place tp be especially since   our community is a pop.1200. Anxiety is a deep inner dark place it can be sneaky/unexpected Energy twirling inside me. It was shared to me to do jumping jacks or If i can EFT TO Lessen it as much or little as i can. Even knowing that in my calm self... ehen anxiety appears that information disappears. 
Getting thru it is relief.
I have Been doing okay these days. Thank you for this.",2017-05-31T06:29:24+0000
1267,96,2,10154449465080685_10154450267190685,data,fetched (200),57:08.8,Facebook:<post>/comments,"I can relate. It's hard, knowing people will judge, and asking prodding questions, or questions that feel like prodding. I have had people judge because of it, say I am looking for attention, I'm being selfish, or whatever. In part, they are somewhat correct, but it is not the attention they think. I seek to draw attention to the disorder, for more understanding and empathetic attitudes towards it, not just for me, but for all others who suffer.

Who could understand and share knowledge about it better than someone who goes through it? So I have to share it. And even though it does bring me some anxiety to do so, I know it's for the better in the long run.",2017-05-31T01:30:08+0000
1268,96,2,10154449465080685_10154449846255685,data,fetched (200),57:08.8,Facebook:<post>/comments,"Yup, been there. It's like a snowball effect yet people can't see the big anxiety snowball bearing down on you like Indiana Jones and his boulder.",2017-05-30T21:45:06+0000
1269,96,2,10154449465080685_10154555667890685,data,fetched (200),57:08.8,Facebook:<post>/comments,Yes sharing amplifies it for me... I feel like I'm in an impossible situation and that there is only one way out...,2017-07-03T04:58:21+0000
